{
  "$schema": "https://json-schema.org/draft/2020-12/schema",
  "title": "AI Device Optimizer Benchmark Result",
  "type": "object",
  "required": ["schemaVersion", "timestampMs", "workload", "samples"],
  "properties": {
    "schemaVersion": { "type": "integer", "enum": [1, 2] },
    "timestampMs": { "type": "integer" },
    "workload": { "type": "string" },
    "device": {
      "type": "object",
      "required": ["androidApi", "manufacturer", "model"],
      "properties": {
        "androidApi": { "type": "integer", "minimum": 1 },
        "manufacturer": { "type": "string" },
        "model": { "type": "string" }
      }
    },
    "samples": {
      "type": "array",
      "items": {
        "type": "object",
        "required": [
          "timestampMs",
          "availableRamMb",
          "batteryPercent",
          "collectionDurationMs"
        ],
        "properties": {
          "timestampMs": { "type": "integer" },
          "availableRamMb": { "type": "integer", "minimum": 0 },
          "totalRamMb": { "type": "integer", "minimum": 0 },
          "batteryPercent": {
            "type": ["integer", "null"],
            "minimum": 0,
            "maximum": 100
          },
          "isCharging": { "type": "boolean" },
          "temperatureC": { "type": ["number", "null"] },
          "storageAvailableMb": { "type": "integer", "minimum": 0 },
          "processCpuTimeMs": { "type": "integer", "minimum": 0 },
          "collectionDurationMs": { "type": "integer", "minimum": 0 }
        }
      }
    }
  }
}
