{
  "schemaVersion": 2,
  "timestampMs": 1790164000328,
  "workload": "monitor_foreground_idle",
  "device": {
    "androidApi": 33,
    "manufacturer": "ITEL",
    "model": "itel P661N"
  },
  "samples": [
    {
      "timestampMs": 1790164000328,
      "availableRamMb": 1585,
      "totalRamMb": 5634,
      "batteryPercent": 44,
      "isCharging": false,
      "temperatureC": 39.5,
      "storageAvailableMb": 32305,
      "processCpuTimeMs": 17727,
      "collectionDurationMs": 3875,
      "processes": [
        {
          "pid": 10656,
          "processName": "com.maouuusama.ai.device.optimizer",
          "packageNames": [
            "com.maouuusama.ai.device.optimizer"
          ],
          "appLabels": [
            "AI Device Optimizer"
          ],
          "importance": 100,
          "importanceLabel": "FOREGROUND",
          "isForeground": true,
          "pssKb": 40733,
          "rssKb": 126400,
          "swapPssKb": 37556
        }
      ]
    },
    {
      "timestampMs": 1790164004205,
      "availableRamMb": 1562,
      "totalRamMb": 5634,
      "batteryPercent": 44,
      "isCharging": false,
      "temperatureC": 39.5,
      "storageAvailableMb": 32305,
      "processCpuTimeMs": 18424,
      "collectionDurationMs": 2526,
      "processes": [
        {
          "pid": 10656,
          "processName": "com.maouuusama.ai.device.optimizer",
          "packageNames": [
            "com.maouuusama.ai.device.optimizer"
          ],
          "appLabels": [
            "AI Device Optimizer"
          ],
          "importance": 100,
          "importanceLabel": "FOREGROUND",
          "isForeground": true,
          "pssKb": 40733,
          "rssKb": 125608,
          "swapPssKb": 37556
        }
      ]
    },
    {
      "timestampMs": 1790164006731,
      "availableRamMb": 1547,
      "totalRamMb": 5634,
      "batteryPercent": 44,
      "isCharging": false,
      "temperatureC": 39.5,
      "storageAvailableMb": 32305,
      "processCpuTimeMs": 18725,
      "collectionDurationMs": 3197,
      "processes": [
        {
          "pid": 10656,
          "processName": "com.maouuusama.ai.device.optimizer",
          "packageNames": [
            "com.maouuusama.ai.device.optimizer"
          ],
          "appLabels": [
            "AI Device Optimizer"
          ],
          "importance": 100,
          "importanceLabel": "FOREGROUND",
          "isForeground": true,
          "pssKb": 40733,
          "rssKb": 133748,
          "swapPssKb": 37556
        }
      ]
    },
    {
      "timestampMs": 1790164009929,
      "availableRamMb": 1559,
      "totalRamMb": 5634,
      "batteryPercent": 44,
      "isCharging": false,
      "temperatureC": 39.5,
      "storageAvailableMb": 32305,
      "processCpuTimeMs": 18781,
      "collectionDurationMs": 2421,
      "processes": [
        {
          "pid": 10656,
          "processName": "com.maouuusama.ai.device.optimizer",
          "packageNames": [
            "com.maouuusama.ai.device.optimizer"
          ],
          "appLabels": [
            "AI Device Optimizer"
          ],
          "importance": 100,
          "importanceLabel": "FOREGROUND",
          "isForeground": true,
          "pssKb": 40733,
          "rssKb": 133440,
          "swapPssKb": 37556
        }
      ]
    },
    {
      "timestampMs": 1790164012350,
      "availableRamMb": 1551,
      "totalRamMb": 5634,
      "batteryPercent": 44,
      "isCharging": false,
      "temperatureC": 39.5,
      "storageAvailableMb": 32305,
      "processCpuTimeMs": 18985,
      "collectionDurationMs": 2195,
      "processes": [
        {
          "pid": 10656,
          "processName": "com.maouuusama.ai.device.optimizer",
          "packageNames": [
            "com.maouuusama.ai.device.optimizer"
          ],
          "appLabels": [
            "AI Device Optimizer"
          ],
          "importance": 100,
          "importanceLabel": "FOREGROUND",
          "isForeground": true,
          "pssKb": 40733,
          "rssKb": 134080,
          "swapPssKb": 37556
        }
      ]
    },
    {
      "timestampMs": 1790164014545,
      "availableRamMb": 1541,
      "totalRamMb": 5634,
      "batteryPercent": 44,
      "isCharging": false,
      "temperatureC": 39.5,
      "storageAvailableMb": 32306,
      "processCpuTimeMs": 19031,
      "collectionDurationMs": 1904,
      "processes": [
        {
          "pid": 10656,
          "processName": "com.maouuusama.ai.device.optimizer",
          "packageNames": [
            "com.maouuusama.ai.device.optimizer"
          ],
          "appLabels": [
            "AI Device Optimizer"
          ],
          "importance": 100,
          "importanceLabel": "FOREGROUND",
          "isForeground": true,
          "pssKb": 40733,
          "rssKb": 135672,
          "swapPssKb": 37556
        }
      ]
    },
    {
      "timestampMs": 1790164016548,
      "availableRamMb": 1539,
      "totalRamMb": 5634,
      "batteryPercent": 44,
      "isCharging": false,
      "temperatureC": 39.5,
      "storageAvailableMb": 32306,
      "processCpuTimeMs": 19087,
      "collectionDurationMs": 1840,
      "processes": [
        {
          "pid": 10656,
          "processName": "com.maouuusama.ai.device.optimizer",
          "packageNames": [
            "com.maouuusama.ai.device.optimizer"
          ],
          "appLabels": [
            "AI Device Optimizer"
          ],
          "importance": 100,
          "importanceLabel": "FOREGROUND",
          "isForeground": true,
          "pssKb": 40733,
          "rssKb": 136252,
          "swapPssKb": 37556
        }
      ]
    },
    {
      "timestampMs": 1790164018550,
      "availableRamMb": 1534,
      "totalRamMb": 5634,
      "batteryPercent": 44,
      "isCharging": false,
      "temperatureC": 39.5,
      "storageAvailableMb": 32306,
      "processCpuTimeMs": 19148,
      "collectionDurationMs": 1846,
      "processes": [
        {
          "pid": 10656,
          "processName": "com.maouuusama.ai.device.optimizer",
          "packageNames": [
            "com.maouuusama.ai.device.optimizer"
          ],
          "appLabels": [
            "AI Device Optimizer"
          ],
          "importance": 100,
          "importanceLabel": "FOREGROUND",
          "isForeground": true,
          "pssKb": 40733,
          "rssKb": 136980,
          "swapPssKb": 37556
        }
      ]
    },
    {
      "timestampMs": 1790164020552,
      "availableRamMb": 1619,
      "totalRamMb": 5634,
      "batteryPercent": 44,
      "isCharging": false,
      "temperatureC": 39.5,
      "storageAvailableMb": 32305,
      "processCpuTimeMs": 19197,
      "collectionDurationMs": 1952,
      "processes": [
        {
          "pid": 10656,
          "processName": "com.maouuusama.ai.device.optimizer",
          "packageNames": [
            "com.maouuusama.ai.device.optimizer"
          ],
          "appLabels": [
            "AI Device Optimizer"
          ],
          "importance": 100,
          "importanceLabel": "FOREGROUND",
          "isForeground": true,
          "pssKb": 40733,
          "rssKb": 136568,
          "swapPssKb": 37556
        }
      ]
    },
    {
      "timestampMs": 1790164022549,
      "availableRamMb": 1635,
      "totalRamMb": 5634,
      "batteryPercent": 44,
      "isCharging": false,
      "temperatureC": 39.5,
      "storageAvailableMb": 32305,
      "processCpuTimeMs": 19270,
      "collectionDurationMs": 1813,
      "processes": [
        {
          "pid": 10656,
          "processName": "com.maouuusama.ai.device.optimizer",
          "packageNames": [
            "com.maouuusama.ai.device.optimizer"
          ],
          "appLabels": [
            "AI Device Optimizer"
          ],
          "importance": 100,
          "importanceLabel": "FOREGROUND",
          "isForeground": true,
          "pssKb": 40733,
          "rssKb": 136888,
          "swapPssKb": 37556
        }
      ]
    },
    {
      "timestampMs": 1790164024549,
      "availableRamMb": 1627,
      "totalRamMb": 5634,
      "batteryPercent": 44,
      "isCharging": false,
      "temperatureC": 39.5,
      "storageAvailableMb": 32305,
      "processCpuTimeMs": 19441,
      "collectionDurationMs": 1940,
      "processes": [
        {
          "pid": 10656,
          "processName": "com.maouuusama.ai.device.optimizer",
          "packageNames": [
            "com.maouuusama.ai.device.optimizer"
          ],
          "appLabels": [
            "AI Device Optimizer"
          ],
          "importance": 100,
          "importanceLabel": "FOREGROUND",
          "isForeground": true,
          "pssKb": 40733,
          "rssKb": 135892,
          "swapPssKb": 37556
        }
      ]
    },
    {
      "timestampMs": 1790164026549,
      "availableRamMb": 1629,
      "totalRamMb": 5634,
      "batteryPercent": 44,
      "isCharging": false,
      "temperatureC": 39.5,
      "storageAvailableMb": 32305,
      "processCpuTimeMs": 19711,
      "collectionDurationMs": 3362,
      "processes": [
        {
          "pid": 10656,
          "processName": "com.maouuusama.ai.device.optimizer",
          "packageNames": [
            "com.maouuusama.ai.device.optimizer"
          ],
          "appLabels": [
            "AI Device Optimizer"
          ],
          "importance": 100,
          "importanceLabel": "FOREGROUND",
          "isForeground": true,
          "pssKb": 40733,
          "rssKb": 133328,
          "swapPssKb": 37556
        }
      ]
    },
    {
      "timestampMs": 1790164029912,
      "availableRamMb": 1622,
      "totalRamMb": 5634,
      "batteryPercent": 44,
      "isCharging": false,
      "temperatureC": 39.5,
      "storageAvailableMb": 32305,
      "processCpuTimeMs": 19750,
      "collectionDurationMs": 2399,
      "processes": [
        {
          "pid": 10656,
          "processName": "com.maouuusama.ai.device.optimizer",
          "packageNames": [
            "com.maouuusama.ai.device.optimizer"